{
  "id": "daiwa-securities-group",
  "name": "Daiwa Securities Group Inc.",
  "type": "listed-company",
  "parentId": null,
  "country": "Japan",
  "note": "Holding company of the Daiwa securities group; listed in Tokyo and Nagoya (code 8601); top-10 shareholders as of 31 March 2026 listed on daiwa-grp.jp."
}
