{
  "id": "international-holding-company",
  "name": "International Holding Company (IHC)",
  "type": "listed-company",
  "country": "United Arab Emirates",
  "parentId": "royal-group",
  "note": "Abu Dhabi royal-family-linked holding company chaired by Sheikh Tahnoon bin Zayed Al Nahyan, brother of the UAE president. Controlled by Royal Group (claim ihc-royal-group-control); Reuters (2024-01-02) puts Royal Group's stake at 61% (linked in that claim's note; reuters.com blocks scripts)."
}
