{
  "id": "shenyang-shengjing-department-store",
  "name": "Shenyang Shengjing Department Store Management (Group) Co., Ltd. (沈阳盛京百货管理（集团）有限公司)",
  "type": "state",
  "parentId": "shenyang-shengjing-assets-group",
  "country": "China",
  "via": "a subsidiary of Shenyang Shengjing Assets Management Group Co., Ltd. (the Shenyang SASAC published the group's recruitment as its subsidiary, 2026-06-08); it operates the Shengjing Department Store (盛京百货) stores",
  "note": "Shenyang department-store retailer (origin of the brand: the former city No. 2 Department Store, '沈阳第二百货商店'); in 2022 it took over the collapsed Xinglong Family retail group's stores. Front-of-shirt sponsor of Liaoning Tieren for the 2026 CSL season."
}
