{
  "id": "boulanger",
  "name": "Boulanger S.A.",
  "type": "private-company",
  "parentId": "united-b",
  "country": "FR",
  "via": "Société anonyme au capital de 40 611 564 €, siège Avenue de la Motte, 59810 Lesquin, RCS Lille 347 384 570 (boulanger.com infos légales)",
  "note": "French electronics retailer; part of the United.b group per Boulanger's own corporate presentation. Emilie Soleri is directrice générale (directrice de la publication)."
}
