{
  "id": "dabl-blek-ooo",
  "name": "OOO «Дабл Блэк» (Double Black LLC)",
  "type": "private-company",
  "country": "Russia",
  "parentId": "kuprin-evgeny",
  "note": "Moscow water-trade company OOO «ДАБЛ БЛЭК» (INN 9715296056, OGRN 1177746252562, registered 15 Mar 2017); the Vorgol natural-water brand's official site vorgolmsk.ru names Trade Company \"Double Black\" as the brand's exclusive distributor, and the site's offer and contacts are OOO «ДАБЛ БЛЭК» (Moscow, ul. Taldomskaya 2G, office@dblack.ru). General director Evgeny Kuprin since 15 Mar 2017 (Saby/SBIS registry)."
}
