{
  "id": "inchcape-plc",
  "name": "Inchcape plc",
  "type": "listed-company",
  "parentId": null,
  "country": "United Kingdom",
  "note": "London-listed car distributor. In Chile it distributes GWM (Great Wall Motor) through Vehículos de Trabajo S.A., per the footer of the GWM Chile site (gwm.cl), which calls Inchcape the authorised distributor of Great Wall Motors Chile."
}
