{
  "id": "agi-business-group",
  "name": "AGI Business Group",
  "type": "private-company",
  "country": "US",
  "parentId": null,
  "note": "Owned by founder Adriana Gallardo, per her biography (claim agi-adrianas-insurance-owner; the club's 2025-11-09 announcement also names her Founder and CEO of Adriana's Insurance)."
}
