{
  "id": "groupama-group",
  "name": "Groupama group",
  "type": "private-company",
  "country": "France",
  "parentId": null,
  "note": "French mutual insurance group, owned by its sociétaires (members) rather than shareholders; no state or fund owner identified. The group's parent legal entity (Groupama Assurances Mutuelles) is not named in the sources checked here. The regional mutual Groupama Paris Val de Loire is recorded separately (groupama-pvl-owner)."
}
