{
  "id": "sitikod-llc",
  "name": "SITIKOD LLC (BETON brand)",
  "type": "private-company",
  "parentId": null,
  "country": "Ukraine",
  "note": "Licensed Ukrainian online-casino and betting operator working under the BETON brand. The club's announcement names SITIKOD LLC; Komersant reports the brand operates through CITYCODE LLC and names Roman Balashov as SITIKOD's founder and beneficial owner. Private ownership; no state link found."
}
