{
  "id": "tmd-friction",
  "name": "TMD Friction Group",
  "type": "private-company",
  "country": "Germany",
  "parentId": "aequita",
  "note": "Brake-friction manufacturer (Textar, Mintex, Don, Pagid, Cobreq). Sold by Nisshinbo Holdings to Munich-based industrial group Aequita in December 2023."
}
