{
  "id": "thai-beverage",
  "name": "Thai Beverage Public Company Limited",
  "type": "listed-company",
  "country": "Thailand",
  "parentId": null,
  "note": "Listed on the Singapore Exchange mainboard (SGX ticker Y92). Annual Report 2025 (statistics of shareholders, as at 11 December 2025): Siriwana Co., Ltd. holds 45.24% directly and is deemed interested in the 20.60% held by wholly-owned Siriwanan Co., Ltd.; members of the Sirivadhanabhakdi family are deemed interested in 65.84% via the trust arrangements. No state holding."
}
