{
  "id": "mozzart-doo",
  "name": "Mozzart d.o.o. Beograd",
  "type": "private-company",
  "country": "Serbia",
  "parentId": null,
  "note": "Serbian sports-betting and gaming company (brand: Mozzart Bet). Per CompanyWall's register data, 36 private owners, the largest Jadranka Stepanovi\u0107 (40.98%) and Dejan \u010cakajac (38.35%)."
}
