{
  "id": "skyward-specialty-insurance-group",
  "name": "Skyward Specialty Insurance Group, Inc.",
  "type": "listed-company",
  "country": "USA",
  "parentId": null,
  "note": "Nasdaq-listed (SKWD) specialty insurer headquartered in Houston, Texas. 'Skyward Group' is the unified holding-company brand over its Skyward Specialty and Apollo businesses (USA Rugby / Skyward Group announcement, 2026-04-08)."
}
