{
  "id": "dewa",
  "name": "Dubai Electricity and Water Authority (DEWA)",
  "type": "listed-company",
  "country": "United Arab Emirates",
  "parentId": "government-of-dubai",
  "note": "Listed on the Dubai Financial Market (ticker DEWA) since April 2022; the Government of Dubai continued to own 82% of its share capital after selling 18% in the IPO (The National, 2022-04-06; Dubai One/WAM)."
}
