{
  "id": "chimera-investments",
  "name": "Chimera Investments LLC",
  "type": "private-company",
  "country": "United Arab Emirates",
  "parentId": null,
  "note": "Abu Dhabi investment firm; Bloomberg calls it part of a business empire overseen by Sheikh Tahnoon bin Zayed Al Nahyan (claim chimera-tahnoon-empire). Majority owner of Colnago since May 2020 (claim colnago-chimera-majority). No checked source here names its parent company, so none is set."
}
