{
  "id": "grimaldi-industri",
  "name": "Grimaldi Industri AB",
  "type": "private-company",
  "country": "Sweden",
  "parentId": null,
  "note": "Swedish holding company owned by Salvatore Grimaldi (BikeBiz, 2000); its bicycle division Cycleurope AB includes Bianchi (F.I.V. Edoardo Bianchi SpA)."
}
